{
  "version": "1.0",
  "fighter": {
    "name": "Sora (Kingdom Hearts 1)",
    "prompt": "sora from kingdom hearts 1",
    "seed": 11111,
    "styleGuide": "Teen anime hero, spiky brown hair, black jacket, red shorts, yellow shoes, silver keyblade."
  },
  "sheet": {
    "path": "sora_atlas.svg",
    "frameWidth": 96,
    "frameHeight": 128
  },
  "animations": {
    "idle": {
      "fps": 12,
      "frames": [
        {
          "x": 0,
          "y": 0,
          "w": 96,
          "h": 128
        },
        {
          "x": 96,
          "y": 0,
          "w": 96,
          "h": 128
        },
        {
          "x": 192,
          "y": 0,
          "w": 96,
          "h": 128
        },
        {
          "x": 288,
          "y": 0,
          "w": 96,
          "h": 128
        },
        {
          "x": 384,
          "y": 0,
          "w": 96,
          "h": 128
        },
        {
          "x": 480,
          "y": 0,
          "w": 96,
          "h": 128
        },
        {
          "x": 576,
          "y": 0,
          "w": 96,
          "h": 128
        },
        {
          "x": 672,
          "y": 0,
          "w": 96,
          "h": 128
        },
        {
          "x": 768,
          "y": 0,
          "w": 96,
          "h": 128
        },
        {
          "x": 864,
          "y": 0,
          "w": 96,
          "h": 128
        }
      ]
    },
    "run": {
      "fps": 12,
      "frames": [
        {
          "x": 960,
          "y": 0,
          "w": 96,
          "h": 128
        },
        {
          "x": 1056,
          "y": 0,
          "w": 96,
          "h": 128
        },
        {
          "x": 1152,
          "y": 0,
          "w": 96,
          "h": 128
        },
        {
          "x": 1248,
          "y": 0,
          "w": 96,
          "h": 128
        },
        {
          "x": 1344,
          "y": 0,
          "w": 96,
          "h": 128
        },
        {
          "x": 1440,
          "y": 0,
          "w": 96,
          "h": 128
        },
        {
          "x": 1536,
          "y": 0,
          "w": 96,
          "h": 128
        },
        {
          "x": 1632,
          "y": 0,
          "w": 96,
          "h": 128
        },
        {
          "x": 1728,
          "y": 0,
          "w": 96,
          "h": 128
        },
        {
          "x": 1824,
          "y": 0,
          "w": 96,
          "h": 128
        },
        {
          "x": 1920,
          "y": 0,
          "w": 96,
          "h": 128
        },
        {
          "x": 2016,
          "y": 0,
          "w": 96,
          "h": 128
        }
      ]
    },
    "jump": {
      "fps": 12,
      "frames": [
        {
          "x": 2112,
          "y": 0,
          "w": 96,
          "h": 128
        },
        {
          "x": 2208,
          "y": 0,
          "w": 96,
          "h": 128
        },
        {
          "x": 2304,
          "y": 0,
          "w": 96,
          "h": 128
        },
        {
          "x": 2400,
          "y": 0,
          "w": 96,
          "h": 128
        },
        {
          "x": 2496,
          "y": 0,
          "w": 96,
          "h": 128
        },
        {
          "x": 2592,
          "y": 0,
          "w": 96,
          "h": 128
        },
        {
          "x": 2688,
          "y": 0,
          "w": 96,
          "h": 128
        },
        {
          "x": 2784,
          "y": 0,
          "w": 96,
          "h": 128
        }
      ]
    },
    "light": {
      "fps": 12,
      "frames": [
        {
          "x": 2880,
          "y": 0,
          "w": 96,
          "h": 128
        },
        {
          "x": 2976,
          "y": 0,
          "w": 96,
          "h": 128
        },
        {
          "x": 3072,
          "y": 0,
          "w": 96,
          "h": 128
        },
        {
          "x": 3168,
          "y": 0,
          "w": 96,
          "h": 128
        },
        {
          "x": 3264,
          "y": 0,
          "w": 96,
          "h": 128
        },
        {
          "x": 3360,
          "y": 0,
          "w": 96,
          "h": 128
        }
      ]
    },
    "heavy": {
      "fps": 12,
      "frames": [
        {
          "x": 3456,
          "y": 0,
          "w": 96,
          "h": 128
        },
        {
          "x": 3552,
          "y": 0,
          "w": 96,
          "h": 128
        },
        {
          "x": 3648,
          "y": 0,
          "w": 96,
          "h": 128
        },
        {
          "x": 3744,
          "y": 0,
          "w": 96,
          "h": 128
        },
        {
          "x": 3840,
          "y": 0,
          "w": 96,
          "h": 128
        },
        {
          "x": 3936,
          "y": 0,
          "w": 96,
          "h": 128
        },
        {
          "x": 4032,
          "y": 0,
          "w": 96,
          "h": 128
        },
        {
          "x": 4128,
          "y": 0,
          "w": 96,
          "h": 128
        },
        {
          "x": 4224,
          "y": 0,
          "w": 96,
          "h": 128
        },
        {
          "x": 4320,
          "y": 0,
          "w": 96,
          "h": 128
        },
        {
          "x": 4416,
          "y": 0,
          "w": 96,
          "h": 128
        },
        {
          "x": 4512,
          "y": 0,
          "w": 96,
          "h": 128
        }
      ]
    },
    "special": {
      "fps": 12,
      "frames": [
        {
          "x": 4608,
          "y": 0,
          "w": 96,
          "h": 128
        },
        {
          "x": 4704,
          "y": 0,
          "w": 96,
          "h": 128
        },
        {
          "x": 4800,
          "y": 0,
          "w": 96,
          "h": 128
        },
        {
          "x": 4896,
          "y": 0,
          "w": 96,
          "h": 128
        },
        {
          "x": 4992,
          "y": 0,
          "w": 96,
          "h": 128
        },
        {
          "x": 5088,
          "y": 0,
          "w": 96,
          "h": 128
        },
        {
          "x": 5184,
          "y": 0,
          "w": 96,
          "h": 128
        },
        {
          "x": 5280,
          "y": 0,
          "w": 96,
          "h": 128
        },
        {
          "x": 5376,
          "y": 0,
          "w": 96,
          "h": 128
        },
        {
          "x": 5472,
          "y": 0,
          "w": 96,
          "h": 128
        },
        {
          "x": 5568,
          "y": 0,
          "w": 96,
          "h": 128
        },
        {
          "x": 5664,
          "y": 0,
          "w": 96,
          "h": 128
        },
        {
          "x": 5760,
          "y": 0,
          "w": 96,
          "h": 128
        },
        {
          "x": 5856,
          "y": 0,
          "w": 96,
          "h": 128
        },
        {
          "x": 5952,
          "y": 0,
          "w": 96,
          "h": 128
        },
        {
          "x": 6048,
          "y": 0,
          "w": 96,
          "h": 128
        },
        {
          "x": 6144,
          "y": 0,
          "w": 96,
          "h": 128
        },
        {
          "x": 6240,
          "y": 0,
          "w": 96,
          "h": 128
        }
      ]
    },
    "block": {
      "fps": 12,
      "frames": [
        {
          "x": 6336,
          "y": 0,
          "w": 96,
          "h": 128
        },
        {
          "x": 6432,
          "y": 0,
          "w": 96,
          "h": 128
        },
        {
          "x": 6528,
          "y": 0,
          "w": 96,
          "h": 128
        },
        {
          "x": 6624,
          "y": 0,
          "w": 96,
          "h": 128
        }
      ]
    },
    "hit": {
      "fps": 12,
      "frames": [
        {
          "x": 6720,
          "y": 0,
          "w": 96,
          "h": 128
        },
        {
          "x": 6816,
          "y": 0,
          "w": 96,
          "h": 128
        },
        {
          "x": 6912,
          "y": 0,
          "w": 96,
          "h": 128
        },
        {
          "x": 7008,
          "y": 0,
          "w": 96,
          "h": 128
        },
        {
          "x": 7104,
          "y": 0,
          "w": 96,
          "h": 128
        }
      ]
    }
  }
}